file_path,file_name,format,width,height,aspect_ratio,file_size_bytes,page_or_component_uses,alt_texts,number_of_uses,public_route_count,unique_or_reused,is_category_fallback,used_in_open_graph,exact_duplicate_group,near_duplicate_groups,dominant_colours,palette_flags,status,phase_1_status,phase_1_note,topic_relevance,realism,colour_visual_interest,composition,technical_quality,brand_suitability,average_score,assessment_notes
public/images/laundry.webp,laundry.webp,webp,1280,1004,1.2749,127970,"route /categories/ [inline] alt=""A practical laundry room with warm finishes and tidy storage."" || route /categories/laundry/ [hero] alt=""A practical laundry room with warm finishes and tidy storage"" || route /guides/cleaning-product-storage-what-to-check-before-buying-cabinets-or-caddies/ [hero] alt=""A practical laundry room with warm finishes, baskets and tidy everyday storage"" || route /guides/ [inline] alt=""A practical laundry room with warm finishes, baskets and tidy everyday storage."" || route /guides/laundry-basket-storage-what-to-sort-before-buying-hampers-or-sorters/ [hero] alt=""A practical laundry room with warm finishes, baskets and tidy everyday storage"" || route /guides/laundry-drying-space-what-to-measure-before-buying-airers-or-racks/ [hero] alt=""A practical laundry room with warm finishes, baskets and tidy everyday storage"" || route /guides/laundry-essentials-australian-homes/ [hero] alt=""A practical laundry room with warm finishes, baskets and tidy everyday storage"" || route /guides/laundry-storage-what-to-measure-and-check-before-you-buy/ [hero] alt=""A practical laundry room with warm finishes, baskets and tidy everyday storage"" || route /guides/laundry-tub-storage-what-to-check-before-buying-under-sink-organisers/ [hero] alt=""A practical laundry room with warm finishes, baskets and tidy everyday storage"" || route /guides/lower-waste-laundry-essentials/ [hero] alt=""Laundry baskets and washing supplies arranged in a compact Australian laundry"" || route /guides/renter-friendly-laundry-storage-what-to-check-before-you-buy/ [hero] alt=""A practical laundry room with warm finishes, baskets and tidy everyday storage"" || route /guides/small-laundry-storage-what-to-check-before-buying-organisers/ [hero] alt=""A practical laundry room with warm finishes, baskets and tidy everyday storage"" || route /guides/washing-machine-and-dryer-space-what-to-measure-before-buying-storage/ [hero] alt=""A practical laundry room with warm finishes, baskets and tidy everyday storage"" || route / [inline] alt=""A practical laundry room with warm finishes and tidy storage."" || route / [inline] alt=""A practical laundry room with warm finishes, baskets and tidy everyday storage."" || source src/components/SimpleCategoryPage.astro:76 [source_literal] alt=""A practical laundry room with warm finishes and tidy storage"" || source src/pages/index.astro:17 [source_literal] alt=""A practical laundry room with warm finishes and tidy storage."" || source src/pages/index.astro:116 [source_literal] alt=""A practical laundry room with warm finishes, baskets and tidy everyday storage."" || source src/pages/categories/index.astro:31 [source_literal] alt=""A practical laundry room with warm finishes and tidy storage."" || source src/pages/guides/index.astro:75 [source_literal] alt=""A practical laundry room with warm finishes, baskets and tidy everyday storage."" || source src/pages/guides/cleaning-product-storage-what-to-check-before-buying-cabinets-or-caddies/index.astro:63 [source_literal] alt=""A practical laundry room with warm finishes, baskets and tidy everyday storage"" || source src/pages/guides/laundry-basket-storage-what-to-sort-before-buying-hampers-or-sorters/index.astro:86 [source_literal] alt=""A practical laundry room with warm finishes, baskets and tidy everyday storage"" || source src/pages/guides/laundry-drying-space-what-to-measure-before-buying-airers-or-racks/index.astro:100 [source_literal] alt=""A practical laundry room with warm finishes, baskets and tidy everyday storage"" || source src/pages/guides/laundry-essentials-australian-homes/index.astro:52 [source_literal] alt=""A practical laundry room with warm finishes, baskets and tidy everyday storage"" || source src/pages/guides/laundry-storage-what-to-measure-and-check-before-you-buy/index.astro:79 [source_literal] alt=""A practical laundry room with warm finishes, baskets and tidy everyday storage"" || source src/pages/guides/laundry-tub-storage-what-to-check-before-buying-under-sink-organisers/index.astro:58 [source_literal] alt=""A practical laundry room with warm finishes, baskets and tidy everyday storage"" || source src/pages/guides/lower-waste-laundry-essentials/index.astro:52 [source_literal] alt=""Laundry baskets and washing supplies arranged in a compact Australian laundry"" || source src/pages/guides/renter-friendly-laundry-storage-what-to-check-before-you-buy/index.astro:68 [source_literal] alt=""A practical laundry room with warm finishes, baskets and tidy everyday storage"" || source src/pages/guides/small-laundry-storage-what-to-check-before-buying-organisers/index.astro:83 [source_literal] alt=""A practical laundry room with warm finishes, baskets and tidy everyday storage"" || source src/pages/guides/washing-machine-and-dryer-space-what-to-measure-before-buying-storage/index.astro:74 [source_literal] alt=""A practical laundry room with warm finishes, baskets and tidy everyday storage""","A practical laundry room with warm finishes and tidy storage || A practical laundry room with warm finishes and tidy storage. || A practical laundry room with warm finishes, baskets and tidy everyday storage || A practical laundry room with warm finishes, baskets and tidy everyday storage. || Laundry baskets and washing supplies arranged in a compact Australian laundry",30,14,reused,True,False,,,#a69786:21% | #4e4334:19% | #7d7161:18% | #bcae9e:17% | #95816d:16%,beige_or_cream | brown | warm_orange_grade,REPLACE,REPLACEMENT ASSET PENDING,,2,4,2,4,4,2,3.0,"A polished grey and timber laundry reused across 14 routes. It cannot honestly support guide-specific alt text about top loaders, renters, narrow rooms, hampers, drying or linen storage."
public/images/living-room.webp,living-room.webp,webp,1280,896,1.4286,110898,"route /categories/ [inline] alt=""A warm living room with timber furniture, soft linen and indoor greenery."" || route /categories/living-spaces/ [hero] alt=""A warm living room with timber shelving, soft furnishings and natural light"" || route /guides/australian-made-gift-ideas-under-100/ [hero] alt=""A small home and lifestyle gift wrapped on a timber table in warm natural light"" || route /guides/living-room-cable-management-what-to-plan-before-buying-organisers/ [hero] alt=""A warm Australian living room with a TV unit, lamp and tidy cable setup"" || route /guides/living-room-lighting-ideas-for-australian-homes/ [hero] alt=""A warm Australian living room with layered lamps, a sofa and soft evening light"" || route /guides/living-room-rug-size-and-placement-what-to-check-before-you-buy/ [hero] alt=""A warm Australian living room with a sofa, coffee table, rug and soft natural light"" || route /guides/living-room-storage-ideas-everyday-australian-homes/ [hero] alt=""A warm living room with tidy storage, soft seating and natural light"" || route /guides/side-tables-coffee-tables-and-console-tables-what-to-compare-before-you-buy/ [hero] alt=""A warm Australian living room with a sofa, coffee table, side table and soft natural light"" || route /guides/sofa-and-seating-layout-what-to-measure-before-buying-furniture/ [hero] alt=""A warm Australian living room with a sofa, rug, coffee table and practical seating layout"" || route /guides/toy-blanket-and-everyday-clutter-control-for-living-rooms/ [hero] alt=""A warm Australian living room with baskets, blankets, toys and tidy everyday storage"" || route /guides/tv-unit-and-media-storage-what-to-measure-before-you-buy/ [hero] alt=""A warm living room with a TV unit, tidy media storage and soft natural light"" || route / [inline] alt=""A warm living room with tidy storage, soft seating and natural light."" || source src/components/SimpleCategoryPage.astro:88 [source_literal] alt=""A warm living room with timber shelving, soft furnishings and natural light"" || source src/components/SimpleGuidePage.astro:21 [source_literal] || source src/layouts/CategoryHubLayout.astro:23 [source_literal] alt=""A warm, tidy Australian home interior"" || source src/pages/index.astro:52 [source_literal] alt=""A warm living room with tidy storage, soft seating and natural light."" || source src/pages/categories/index.astro:52 [source_literal] alt=""A warm living room with timber furniture, soft linen and indoor greenery."" || source src/pages/guides/australian-made-gift-ideas-under-100/index.astro:47 [source_literal] alt=""A small home and lifestyle gift wrapped on a timber table in warm natural light"" || source src/pages/guides/living-room-cable-management-what-to-plan-before-buying-organisers/index.astro:68 [source_literal] alt=""A warm Australian living room with a TV unit, lamp and tidy cable setup"" || source src/pages/guides/living-room-lighting-ideas-for-australian-homes/index.astro:74 [source_literal] alt=""A warm Australian living room with layered lamps, a sofa and soft evening light"" || source src/pages/guides/living-room-rug-size-and-placement-what-to-check-before-you-buy/index.astro:78 [source_literal] alt=""A warm Australian living room with a sofa, coffee table, rug and soft natural light"" || source src/pages/guides/living-room-storage-ideas-everyday-australian-homes/index.astro:88 [source_literal] alt=""A warm living room with tidy storage, soft seating and natural light"" || source src/pages/guides/side-tables-coffee-tables-and-console-tables-what-to-compare-before-you-buy/index.astro:73 [source_literal] alt=""A warm Australian living room with a sofa, coffee table, side table and soft natural light"" || source src/pages/guides/sofa-and-seating-layout-what-to-measure-before-buying-furniture/index.astro:63 [source_literal] alt=""A warm Australian living room with a sofa, rug, coffee table and practical seating layout"" || source src/pages/guides/toy-blanket-and-everyday-clutter-control-for-living-rooms/index.astro:73 [source_literal] alt=""A warm Australian living room with baskets, blankets, toys and tidy everyday storage"" || source src/pages/guides/tv-unit-and-media-storage-what-to-measure-before-you-buy/index.astro:83 [source_literal] alt=""A warm living room with a TV unit, tidy media storage and soft natural light""","A small home and lifestyle gift wrapped on a timber table in warm natural light || A warm Australian living room with a TV unit, lamp and tidy cable setup || A warm Australian living room with a sofa, coffee table, rug and soft natural light || A warm Australian living room with a sofa, coffee table, side table and soft natural light || A warm Australian living room with a sofa, rug, coffee table and practical seating layout || A warm Australian living room with baskets, blankets, toys and tidy everyday storage || A warm Australian living room with layered lamps, a sofa and soft evening light || A warm living room with a TV unit, tidy media storage and soft natural light || A warm living room with tidy storage, soft seating and natural light || A warm living room with tidy storage, soft seating and natural light. || A warm living room with timber furniture, soft linen and indoor greenery. || A warm living room with timber shelving, soft furnishings and natural light || A warm, tidy Australian home interior",26,12,reused,True,False,,,#a38c6e:21% | #422f1c:20% | #6b543a:17% | #886b4c:16% | #c0b09a:15%,beige_or_cream | brown | warm_orange_grade,REPLACE,REPLACEMENT ASSET PENDING,,2,4,2,3,4,2,2.83,"A generic beige and timber living room reused across 12 routes. It does not explain TV placement, cable control, toy storage, traffic flow or small-room layout."
public/images/Media Room.webp,Media Room.webp,webp,1280,896,1.4286,359905,,,0,0,unique,False,False,,,#352f2a:22% | #2a221c:19% | #141210:19% | #1e2020:16% | #5b4f44:13%,brown,REPLACE,REPLACEMENT ASSET PENDING,,3,4,2,3,4,2,3.0,Apparently unused. The dark stone and timber room feels niche and high-end rather than representative; replace only if the file is brought back into use.
public/images/nursery-home-hero.png,nursery-home-hero.png,png,1536,1024,1.5,2441811,,,0,0,unique,False,False,,,#714b29:18% | #9a7951:18% | #c4ab8e:18% | #d9cdbe:16% | #b18356:16%,beige_or_cream | brown | warm_orange_grade,KEEP,FINAL KEEP,,5,4,3,4,4,4,4.0,"Apparently unused, but it is a credible nursery source with cot, change area and circulation visible. Preserve for possible deliberate reuse."
public/images/Nursery-kids.webp,Nursery-kids.webp,webp,1280,896,1.4286,368810,"route /categories/ [inline] alt=""A tidy nursery room with timber furniture, soft lighting and practical baby storage."" || route /categories/nursery-kids/ [hero] alt=""A tidy nursery room with timber furniture, soft lighting and practical baby storage"" || route /guides/baby-bath-time-essentials/ [hero] alt=""A tidy nursery with soft light, baby storage and everyday care items"" || route /guides/baby-monitors-australia/ [hero] alt=""A tidy nursery room with timber furniture, soft lighting and practical baby storage"" || route /guides/baby-outing-essentials-what-to-pack-before-leaving-the-house/ [hero] alt=""A tidy nursery with practical baby storage and soft natural light"" || route /guides/bassinet-vs-cot/ [hero] alt=""A tidy nursery with a cot, change area and practical baby storage"" || route /guides/ [inline] alt=""A tidy nursery room with timber furniture, soft lighting and practical baby storage."" || route /guides/kids-play-and-toy-storage-what-to-plan-before-buying/ [hero] alt=""A practical children’s play area with low toy storage, books and clear floor space"" || route /guides/nappy-change-station-checklist/ [hero] alt=""A tidy nursery room with timber furniture, soft lighting and practical baby storage"" || route /guides/newborn-essentials/ [hero] alt=""A tidy nursery room with timber furniture, soft lighting and practical baby storage"" || route /guides/nursery-essentials-for-australian-homes/ [hero] alt=""A tidy nursery room with timber furniture, soft lighting and practical baby storage"" || route /guides/nursery-storage-small-rooms/ [hero] alt=""A tidy nursery room with timber storage, soft lighting and baby essentials"" || route / [inline] alt=""A tidy nursery room with timber furniture, soft lighting and practical baby storage."" || source src/components/SimpleCategoryPage.astro:64 [source_literal] alt=""A tidy nursery room with timber furniture, soft lighting and practical baby storage"" || source src/components/SimpleGuidePage.astro:21 [source_literal] || source src/pages/index.astro:45 [source_literal] alt=""A tidy nursery room with timber furniture, soft lighting and practical baby storage."" || source src/pages/index.astro:132 [source_literal] alt=""A tidy nursery room with timber furniture, soft lighting and practical baby storage."" || source src/pages/categories/index.astro:10 [source_literal] alt=""A tidy nursery room with timber furniture, soft lighting and practical baby storage."" || source src/pages/guides/index.astro:107 [source_literal] alt=""A tidy nursery room with timber furniture, soft lighting and practical baby storage."" || source src/pages/categories/nursery-kids/index.astro:28 [source_literal] alt=""A tidy nursery room with timber furniture, soft lighting and practical baby storage"" || source src/pages/guides/baby-bath-time-essentials/index.astro:63 [source_literal] alt=""A tidy nursery with soft light, baby storage and everyday care items"" || source src/pages/guides/baby-monitors-australia/index.astro:91 [source_literal] alt=""A tidy nursery room with timber furniture, soft lighting and practical baby storage"" || source src/pages/guides/baby-outing-essentials-what-to-pack-before-leaving-the-house/index.astro:63 [source_literal] alt=""A tidy nursery with practical baby storage and soft natural light"" || source src/pages/guides/bassinet-vs-cot/index.astro:71 [source_literal] alt=""A tidy nursery with a cot, change area and practical baby storage"" || source src/pages/guides/kids-play-and-toy-storage-what-to-plan-before-buying/index.astro:53 [source_literal] alt=""A practical children’s play area with low toy storage, books and clear floor space"" || source src/pages/guides/nappy-change-station-checklist/index.astro:53 [source_literal] alt=""A tidy nursery room with timber furniture, soft lighting and practical baby storage"" || source src/pages/guides/newborn-essentials/index.astro:93 [source_literal] alt=""A tidy nursery room with timber furniture, soft lighting and practical baby storage"" || source src/pages/guides/nursery-essentials-for-australian-homes/index.astro:101 [source_literal] alt=""A tidy nursery room with timber furniture, soft lighting and practical baby storage"" || source src/pages/guides/nursery-storage-small-rooms/index.astro:96 [source_literal] alt=""A tidy nursery room with timber storage, soft lighting and baby essentials""","A practical children’s play area with low toy storage, books and clear floor space || A tidy nursery room with timber furniture, soft lighting and practical baby storage || A tidy nursery room with timber furniture, soft lighting and practical baby storage. || A tidy nursery room with timber storage, soft lighting and baby essentials || A tidy nursery with a cot, change area and practical baby storage || A tidy nursery with practical baby storage and soft natural light || A tidy nursery with soft light, baby storage and everyday care items",29,13,reused,True,False,,,#af9c85:21% | #664a32:20% | #bdb09e:19% | #8a745b:17% | #a27e5e:14%,beige_or_cream | brown | warm_orange_grade,REPLACE,REPLACEMENT ASSET PENDING,,2,4,2,3,4,2,2.83,"A wide beige and timber nursery used across 13 routes covering babies, older children, toy storage, shared rooms and furniture anchoring. It cannot explain all of those subjects."
public/images/outdoor-garden.webp,outdoor-garden.webp,webp,900,620,1.4516,90982,"route /categories/ [inline] alt=""A warm Australian patio garden with timber seating, native greenery and soft afternoon light."" || route /categories/outdoor-garden/ [hero] alt=""A warm Australian patio garden with timber seating, native greenery and soft afternoon light"" || route /guides/balcony-and-courtyard-garden-setup-what-to-plan-before-buying-pots-and-planters/ [hero] alt=""An Australian balcony or courtyard garden with pots, planters and outdoor greenery"" || route /guides/barbecue-area-setup-what-to-measure-before-buying-outdoor-cooking-gear/ [hero] alt=""An Australian patio with a barbecue area, outdoor furniture and garden greenery"" || route /guides/garden-tool-care-and-seasonal-outdoor-reset/ [hero] alt=""Clean garden hand tools stored beside pots in a practical outdoor work area"" || route /guides/ [inline] alt=""A warm Australian patio garden with outdoor seating, greenery and practical storage."" || route /guides/outdoor-dining-area-setup-what-to-measure-before-buying-furniture/ [hero] alt=""An Australian outdoor dining area with a table, chairs and garden greenery"" || route /guides/outdoor-entertaining-area-setup-what-to-plan-before-buying-extra-furniture-and-accessories/ [hero] alt=""An Australian patio set up for outdoor entertaining with seating, plants and natural light"" || route /guides/outdoor-lounge-area-setup-what-to-measure-before-buying-seating/ [hero] alt=""An Australian outdoor lounge area with comfortable seating, greenery and natural light"" || route /guides/outdoor-shade-setup-for-patios-and-backyards-what-to-check-before-buying/ [hero] alt=""An Australian patio garden with outdoor seating, greenery and a shaded area"" || route /guides/outdoor-storage-for-small-australian-backyards-what-to-plan-before-buying/ [hero] alt=""A compact Australian backyard with outdoor seating, greenery and practical storage"" || route /guides/outdoor-storage-ideas-australian-patios-balconies-gardens/ [hero] alt=""A warm Australian patio garden with outdoor seating, greenery and practical storage"" || route / [inline] alt=""A warm Australian patio garden with outdoor seating, greenery and practical storage."" || source src/components/SimpleCategoryPage.astro:108 [source_literal] alt=""A warm Australian patio garden with timber seating, native greenery and soft afternoon light"" || source src/pages/index.astro:73 [source_literal] alt=""A warm Australian patio garden with outdoor seating, greenery and practical storage."" || source src/pages/categories/index.astro:73 [source_literal] alt=""A warm Australian patio garden with timber seating, native greenery and soft afternoon light."" || source src/pages/guides/index.astro:115 [source_literal] alt=""A warm Australian patio garden with outdoor seating, greenery and practical storage."" || source src/pages/guides/balcony-and-courtyard-garden-setup-what-to-plan-before-buying-pots-and-planters/index.astro:63 [source_literal] alt=""An Australian balcony or courtyard garden with pots, planters and outdoor greenery"" || source src/pages/guides/barbecue-area-setup-what-to-measure-before-buying-outdoor-cooking-gear/index.astro:63 [source_literal] alt=""An Australian patio with a barbecue area, outdoor furniture and garden greenery"" || source src/pages/guides/garden-tool-care-and-seasonal-outdoor-reset/index.astro:53 [source_literal] alt=""Clean garden hand tools stored beside pots in a practical outdoor work area"" || source src/pages/guides/outdoor-dining-area-setup-what-to-measure-before-buying-furniture/index.astro:83 [source_literal] alt=""An Australian outdoor dining area with a table, chairs and garden greenery"" || source src/pages/guides/outdoor-entertaining-area-setup-what-to-plan-before-buying-extra-furniture-and-accessories/index.astro:63 [source_literal] alt=""An Australian patio set up for outdoor entertaining with seating, plants and natural light"" || source src/pages/guides/outdoor-lounge-area-setup-what-to-measure-before-buying-seating/index.astro:78 [source_literal] alt=""An Australian outdoor lounge area with comfortable seating, greenery and natural light"" || source src/pages/guides/outdoor-shade-setup-for-patios-and-backyards-what-to-check-before-buying/index.astro:68 [source_literal] alt=""An Australian patio garden with outdoor seating, greenery and a shaded area"" || source src/pages/guides/outdoor-storage-for-small-australian-backyards-what-to-plan-before-buying/index.astro:88 [source_literal] alt=""A compact Australian backyard with outdoor seating, greenery and practical storage"" || source src/pages/guides/outdoor-storage-ideas-australian-patios-balconies-gardens/index.astro:88 [source_literal] alt=""A warm Australian patio garden with outdoor seating, greenery and practical storage""","A compact Australian backyard with outdoor seating, greenery and practical storage || A warm Australian patio garden with outdoor seating, greenery and practical storage || A warm Australian patio garden with outdoor seating, greenery and practical storage. || A warm Australian patio garden with timber seating, native greenery and soft afternoon light || A warm Australian patio garden with timber seating, native greenery and soft afternoon light. || An Australian balcony or courtyard garden with pots, planters and outdoor greenery || An Australian outdoor dining area with a table, chairs and garden greenery || An Australian outdoor lounge area with comfortable seating, greenery and natural light || An Australian patio garden with outdoor seating, greenery and a shaded area || An Australian patio set up for outdoor entertaining with seating, plants and natural light || An Australian patio with a barbecue area, outdoor furniture and garden greenery || Clean garden hand tools stored beside pots in a practical outdoor work area",26,13,reused,True,False,,,#75663b:20% | #35341d:18% | #5a4f2a:17% | #3b4631:17% | #978454:17%,dull_green | brown | warm_orange_grade,REPLACE,REPLACEMENT ASSET PENDING,,2,4,3,4,4,3,3.33,"A pleasant but heavily warm-graded courtyard reused across 13 routes. It does not show the sheds, balconies, hoses, tools, weather exposure or renter constraints described by different guides."
public/images/pet.webp,pet.webp,webp,1280,897,1.427,110282,,,0,0,unique,False,False,,,#3d2711:24% | #705236:21% | #896d52:17% | #ae967a:17% | #a08062:10%,beige_or_cream | brown | warm_orange_grade,URGENT REPLACEMENT,TEMPORARILY REMOVED FROM PUBLIC USE,The file remains in the repository for audit history but has no source or built public reference. pet-essentials-home-zones.webp is the temporary safe fallback.,3,2,2,3,4,1,2.5,"This high-reach fallback combines cat furniture, an aquarium, a dog bed and product shelves in one artificial timber showroom. Several package labels are unreadable or invented, making the generated origin obvious across 14 routes."
public/images/pet2.webp,pet2.webp,webp,1672,941,1.7768,2266108,,,0,0,unique,False,False,,,#a3886e:21% | #48301a:20% | #c2b2a0:16% | #715840:16% | #8b603e:15%,beige_or_cream | brown | warm_orange_grade,KEEP,FINAL KEEP,,4,5,3,4,4,4,4.0,Apparently unused. A credible dog-bed scene with no visible branding; retain as a possible source for a deliberately matched guide.
public/images/shane.webp,shane.webp,webp,1122,1402,0.8003,107192,,,0,0,unique,False,False,,,#7c7154:29% | #504832:22% | #b2bbd4:17% | #c6cfe8:13% | #ab9e89:9%,brown,KEEP,FINAL KEEP,,5,5,4,4,4,5,4.5,"A credible author portrait. The automated route scan found no current use, but it should be retained."
